{
  "interrupt_id": "interrupt-001",
  "obligation_ref": "sha256:1111111111111111111111111111111111111111111111111111111111111111",
  "continuation_ref": "continuation:demo-001",
  "capability_requirements": {
    "reasoning": "deep",
    "tools": [
      "web"
    ]
  },
  "input_schema": "sha256:3333333333333333333333333333333333333333333333333333333333333333",
  "input": {
    "evidence": "sha256:4444444444444444444444444444444444444444444444444444444444444444"
  },
  "output_schema": "urn:cognitive-interrupt-engine:schema:cognitive-result:0.1",
  "created_at": "2026-09-22T05:00:00Z"
}
